<?xml version="1.0" encoding="UTF-8"?>
<!DOCTYPE library SYSTEM "library.dtd" >

<library>
	<book date="foo" isbn="foo">
		<author>Richard S. Sutton</author>
		<author>Andrew G. Barto</author>
        <tag>Computer Science</tag>
        <tag>Artificial Intelligence</tag>
        <tag>Reinforcement Learning</tag>
    </book>
	<foo date="2009-12-11" isbn="0136042594">
		<title><![CDATA[Artificial Intelligence: A Modern Approach]]></title>
		<author>Stuart Russell</author>
		<author>Peter Norvig</author>
        <tag>Computer Science</tag>
        <tag>Artificial Intelligence</tag>
    </foo>
</library>
